{
  "$schema": "http://json-schema.org/draft-04/schema#",
  "type": "object",
  "properties": {
    "name": {
      "type": "string"
    },
    "number": {
      "type": "integer"
    },
    "generated_datetime": {
      "type": "string"
    },
    "pre-search": {
      "type": "array",
      "items": {
        "$ref": "#/definitions/phrase"
      }
    },
    "goals": {
      "type": "array",
      "items": {
        "$ref": "#/definitions/goal"
      }
    },
    "mentions": {
      "type": "object",
      "properties": {
        "logic_rule": {
          "type": "string",
          "format": "logic-rule-pattern"
        },
        "_comment": {
          "type": "string"
        },
        "termlists": {
          "type": "array",
          "items": {
            "$ref": "#/definitions/termlist"
          }
        }
      },
      "required": [
        "logic_rule",
        "termlists"
      ],
      "additionalProperties": false
    }
  },
  "required": [
    "name",
    "number",
    "generated_datetime",
    "goals",
    "mentions"
  ],
  "additionalProperties": false,
  "definitions":{
    "termlist": {
        "type": "object",
        "properties": {
          "termlist_name": {
            "type": "string"
          },
          "formatting_rule": {
              "type": "string"
          },
          "na": {
              "type": "boolean"
          },
          "case": {
              "type": "boolean"
          },
          "_comment": {
            "type": "string"
          },
          "wordlist_en": {
              "type": "array",
              "items": {
                  "type": "string"
              }
          },
          "wordlist_no": {
              "type": "array",
              "items": {
                  "type": "string"
              }
          }
        },
        "required": [
            "termlist_name",
            "formatting_rule",
            "na",
            "case",
            "wordlist_en",
            "wordlist_no"
        ],
      "additionalProperties": false
    },
    "phrase": {
      "type": "object",
          "properties": {
            "name": {
              "type": "string"
            },
            "number": {
              "type": "integer"
            },
            "_comment": {
              "type": "string"
            },
            "logic_rule": {
              "type": "string",
              "format": "logic-rule-pattern"
            },
            "sentence_split": {
              "type": "boolean"
            },
            "termlists": {
              "type": "array",
              "items": {
                "$ref": "#/definitions/termlist"
              }
            }
          },
          "additionalProperties": false,
          "required": [
            "logic_rule",
            "sentence_split",
            "termlists"
          ]
        },
    "goal": {
          "type": "object",
          "properties": {
            "name": {
              "type": "string"
            },
            "phrases": {
              "type": "array",
              "items": {
                "$ref": "#/definitions/phrase"
              }
            }
          },
          "required": [
            "name",
            "phrases"
          ],
          "additionalProperties": false
        }
  }
}