{
    "name": "sdg13",
    "number": 13,
    "generated_datetime": "09-12-2025 10:07:35",
    "pre-search": [],
    "goals": [
        {
            "name": "1",
            "phrases": [
                {
                    "number": 1,
                    "logic_rule": "()",
                    "sentence_split": false,
                    "termlists": [
                        {
                            "termlist_name": "",
                            "formatting_rule": "",
                            "na": false,
                            "case": false,
                            "wordlist_en": [],
                            "wordlist_no": []
                        }
                    ]
                }
            ]
        },
        {
            "name": "2",
            "phrases": [
                {
                    "number": 1,
                    "logic_rule": "()",
                    "sentence_split": false,
                    "termlists": [
                        {
                            "termlist_name": "",
                            "formatting_rule": "",
                            "na": false,
                            "case": false,
                            "wordlist_en": [],
                            "wordlist_no": []
                        }
                    ]
                },
                {
                    "number": 2,
                    "logic_rule": "()",
                    "sentence_split": false,
                    "termlists": [
                        {
                            "termlist_name": "",
                            "formatting_rule": "",
                            "na": false,
                            "case": false,
                            "wordlist_en": [],
                            "wordlist_no": []
                        }
                    ]
                },
                {
                    "number": 3,
                    "logic_rule": "()",
                    "sentence_split": false,
                    "termlists": [
                        {
                            "termlist_name": "",
                            "formatting_rule": "",
                            "na": false,
                            "case": false,
                            "wordlist_en": [],
                            "wordlist_no": []
                        }
                    ]
                }
            ]
        },
        {
            "name": "3",
            "phrases": [
                {
                    "number": 1,
                    "logic_rule": "()",
                    "sentence_split": false,
                    "termlists": [
                        {
                            "termlist_name": "",
                            "formatting_rule": "",
                            "na": false,
                            "case": false,
                            "wordlist_en": [],
                            "wordlist_no": []
                        }
                    ]
                }
            ]
        },
        {
            "name": "a",
            "phrases": [
                {
                    "number": 1,
                    "logic_rule": "()",
                    "sentence_split": false,
                    "termlists": [
                        {
                            "termlist_name": "",
                            "formatting_rule": "",
                            "na": false,
                            "case": false,
                            "wordlist_en": [],
                            "wordlist_no": []
                        }
                    ]
                },
                {
                    "number": 2,
                    "logic_rule": "()",
                    "sentence_split": false,
                    "termlists": [
                        {
                            "termlist_name": "",
                            "formatting_rule": "",
                            "na": false,
                            "case": false,
                            "wordlist_en": [],
                            "wordlist_no": []
                        }
                    ]
                },
                {
                    "number": 3,
                    "logic_rule": "()",
                    "sentence_split": false,
                    "termlists": [
                        {
                            "termlist_name": "",
                            "formatting_rule": "",
                            "na": false,
                            "case": false,
                            "wordlist_en": [],
                            "wordlist_no": []
                        }
                    ]
                }
            ]
        },
        {
            "name": "b",
            "phrases": [
                {
                    "number": 1,
                    "logic_rule": "()",
                    "sentence_split": false,
                    "termlists": [
                        {
                            "termlist_name": "",
                            "formatting_rule": "",
                            "na": false,
                            "case": false,
                            "wordlist_en": [],
                            "wordlist_no": []
                        }
                    ]
                }
            ]
        }
    ],
    "mentions": {
        "logic_rule": "()",
        "termlists": [
            {
                "termlist_name": "",
                "formatting_rule": "",
                "na": false,
                "case": false,
                "wordlist_en": [],
                "wordlist_no": []
            },
            {
                "termlist_name": "",
                "formatting_rule": "",
                "na": false,
                "case": false,
                "wordlist_en": [],
                "wordlist_no": []
            }
        ]
    }
}